[
  {
    "id": "run-bac9bec84c474b95",
    "task_id": "duration-sum",
    "criterion_id": "repro",
    "attempt_id": "att-885afad123d54fe1",
    "producer": "worker",
    "target": "base",
    "tree": "ca45147360c964475e81717a19bb3db13f6ece99",
    "check_version": "1",
    "environment": "",
    "command": "python3 -c 'from durations import parse_duration as p; assert p(\"1h30m\")==5400 and p(\"2m10s\")==130 and p(\"45s\")==45'",
    "exit_code": 1,
    "timed_out": false,
    "vacuous": null,
    "duration_ms": 102,
    "output_ref": "artifacts/sha256/09a596a85bd2c6b81ed1c4f1519e29c8f5cdb5b6a1f7e3b5bde6b48fad697970",
    "output_tail": "Traceback (most recent call last):\n  File \"<string>\", line 1, in <module>\nAssertionError\n",
    "recorded_at": "2026-10-06T02:28:02.434806217Z"
  },
  {
    "id": "run-3265ed3098134cfd",
    "task_id": "duration-sum",
    "criterion_id": "regression",
    "attempt_id": "att-885afad123d54fe1",
    "producer": "worker",
    "target": "base",
    "tree": "ca45147360c964475e81717a19bb3db13f6ece99",
    "check_version": "1",
    "environment": "",
    "command": "python3 -m unittest discover -s tests -t .",
    "exit_code": 0,
    "timed_out": false,
    "vacuous": null,
    "duration_ms": 102,
    "output_ref": "artifacts/sha256/33060fd73862c5e1af97335504d5b45211fce6d229657f556d8deceeadc52ce4",
    "output_tail": "...\n----------------------------------------------------------------------\nRan 3 tests in 0.000s\n\nOK\n",
    "recorded_at": "2026-10-06T02:28:02.624610767Z"
  },
  {
    "id": "run-db71233721a44500",
    "task_id": "duration-sum",
    "criterion_id": "repro",
    "attempt_id": "att-885afad123d54fe1",
    "producer": "worker",
    "target": "output",
    "tree": "4688fba1015d33dedf241719d5caee3cfb7ffa3c",
    "check_version": "1",
    "environment": "",
    "command": "python3 -c 'from durations import parse_duration as p; assert p(\"1h30m\")==5400 and p(\"2m10s\")==130 and p(\"45s\")==45'",
    "exit_code": 0,
    "timed_out": false,
    "vacuous": null,
    "duration_ms": 101,
    "output_ref": "artifacts/sha256/e3b0c44298fc1c149afbf4c8996fb92427ae41e4649b934ca495991b7852b855",
    "output_tail": "",
    "recorded_at": "2026-10-06T02:28:06.585673027Z"
  },
  {
    "id": "run-b9298d691d7f460e",
    "task_id": "duration-sum",
    "criterion_id": "regression",
    "attempt_id": "att-885afad123d54fe1",
    "producer": "worker",
    "target": "output",
    "tree": "4688fba1015d33dedf241719d5caee3cfb7ffa3c",
    "check_version": "1",
    "environment": "",
    "command": "python3 -m unittest discover -s tests -t .",
    "exit_code": 0,
    "timed_out": false,
    "vacuous": null,
    "duration_ms": 102,
    "output_ref": "artifacts/sha256/feabb4add9e2ca3374e538560634d1ec97dc4f4ce89aab12f3d726e36ea9b2f6",
    "output_tail": "....\n----------------------------------------------------------------------\nRan 4 tests in 0.001s\n\nOK\n",
    "recorded_at": "2026-10-06T02:28:06.760273590Z"
  },
  {
    "id": "run-0d1131af405342c9",
    "task_id": "duration-sum",
    "criterion_id": "repro",
    "attempt_id": "att-410623b63d22418d",
    "producer": "verifier",
    "target": "output",
    "tree": "4688fba1015d33dedf241719d5caee3cfb7ffa3c",
    "check_version": "1",
    "environment": "",
    "command": "python3 -c 'from durations import parse_duration as p; assert p(\"1h30m\")==5400 and p(\"2m10s\")==130 and p(\"45s\")==45'",
    "exit_code": 0,
    "timed_out": false,
    "vacuous": null,
    "duration_ms": 102,
    "output_ref": "artifacts/sha256/e3b0c44298fc1c149afbf4c8996fb92427ae41e4649b934ca495991b7852b855",
    "output_tail": "",
    "recorded_at": "2026-10-06T02:28:21.387730880Z"
  },
  {
    "id": "run-0cbb17588c8b4fb0",
    "task_id": "duration-sum",
    "criterion_id": "regression",
    "attempt_id": "att-410623b63d22418d",
    "producer": "verifier",
    "target": "output",
    "tree": "4688fba1015d33dedf241719d5caee3cfb7ffa3c",
    "check_version": "1",
    "environment": "",
    "command": "python3 -m unittest discover -s tests -t .",
    "exit_code": 0,
    "timed_out": false,
    "vacuous": null,
    "duration_ms": 102,
    "output_ref": "artifacts/sha256/e6ec182765cd965f2837d8eeaef5a64af48a104f245cd1a0b7281559194c57c1",
    "output_tail": "....\n----------------------------------------------------------------------\nRan 4 tests in 0.000s\n\nOK\n",
    "recorded_at": "2026-10-06T02:28:21.567295198Z"
  }
]
